,index,0,Source,Name,P-value,P-adjust,VIP_scaled
2730,R-HSA-9734009,1.0233370755478468,Transcriptomics,Defective Intrinsic Pathway for Apoptosis,0.7192,0.8854020979020979,-0.7197612566535361
2731,R-HSA-9006936,1.0232594232097676,Transcriptomics,Signaling by TGFB family members,0.7668,0.8996982903117667,-0.7199627954034711
2732,R-HSA-8963693,2.1186892878280816,Metabolomics,Aspartate and asparagine metabolism,0.7548,0.8946156451066711,-0.721138090812104
2733,R-HSA-176187,1.0223551636854147,Transcriptomics,Activation of ATR in response to replication stress,0.6266,0.8777425373134329,-0.7223097090787433
2734,R-HSA-9013424,1.18391664009379,Proteomics,RHOV GTPase cycle,0.8663,0.9239406779661016,-0.7236486350620471
2735,R-HSA-199992,1.0209918321840128,Transcriptomics,trans-Golgi Network Vesicle Budding,0.6978,0.8854020979020979,-0.7258480974046602
2736,R-HSA-182971,1.0208664300576236,Transcriptomics,EGFR downregulation,0.6518,0.8777425373134329,-0.7261735658762715
2737,R-HSA-8866423,1.1816755583685643,Proteomics,VLDL assembly,0.3692,0.8777425373134329,-0.7285379795635467
2738,R-HSA-8964041,1.1816755583685643,Proteomics,LDL remodeling,0.3692,0.8777425373134329,-0.7285379795635467
2739,R-HSA-186797,1.0198645766148697,Transcriptomics,Signaling by PDGF,0.6332,0.8777425373134329,-0.7287737746460934
2740,R-HSA-9013406,1.0194980617845892,Transcriptomics,RHOQ GTPase cycle,0.7832,0.9003598298985933,-0.7297250266309602
2741,R-HSA-9023661,1.0191710379963324,Transcriptomics,Biosynthesis of E-series 18(R)-resolvins,0.4613,0.8777425373134329,-0.7305737836306153
2742,R-HSA-9018681,1.0191710379963324,Transcriptomics,Biosynthesis of protectins,0.4613,0.8777425373134329,-0.7305737836306153
2743,R-HSA-9013973,1.01899465682793,Transcriptomics,TICAM1-dependent activation of IRF3/IRF7,0.7544,0.8946156451066711,-0.7310315630236277
2744,R-HSA-444209,2.0976199497920045,Metabolomics,Free fatty acid receptors,0.7854,0.9003598298985933,-0.7313168849127737
2745,R-HSA-9024446,1.018631437415339,Transcriptomics,NR1H2 and NR1H3-mediated signaling,0.6963,0.8849128540305011,-0.7319742620868689
2746,R-HSA-9648025,1.018536481554497,Transcriptomics,EML4 and NUDC in mitotic spindle formation,0.6367,0.8777425373134329,-0.7322207103711891
2747,R-HSA-9660826,1.1796407443555048,Proteomics,Purinergic signaling in leishmaniasis infection,0.6587,0.8777425373134329,-0.7329773119601932
2748,R-HSA-9664424,1.1796407443555048,Proteomics,Cell recruitment (pro-inflammatory response),0.6587,0.8777425373134329,-0.7329773119601932
2749,R-HSA-9616222,1.0180925846451379,Transcriptomics,Transcriptional regulation of granulopoiesis,0.8011,0.902319257837492,-0.7333727996762275
2750,R-HSA-111465,1.1793225617544167,Proteomics,Apoptotic cleavage of cellular proteins,0.6776,0.8786055923473142,-0.7336714876047455
2751,R-HSA-5621575,1.0179356951480807,Transcriptomics,CD209 (DC-SIGN) signaling,0.7429,0.8907673860911272,-0.7337799904176394
2752,R-HSA-391251,1.0177987045255505,Transcriptomics,Protein folding,0.722,0.8854020979020979,-0.7341355356529856
2753,R-HSA-76002,1.0175229166776785,Transcriptomics,"Platelet activation, signaling and aggregation",0.7543,0.8946156451066711,-0.7348513149776302
2754,R-HSA-9671555,1.1780303220796604,Proteomics,Signaling by PDGFR in disease,0.8434,0.9132457496136012,-0.7364907533536343
2755,R-HSA-3000471,1.0162658623833334,Transcriptomics,Scavenging by Class B Receptors,0.4892,0.8777425373134329,-0.7381138716159684
2756,R-HSA-2500257,1.0146248290194426,Transcriptomics,Resolution of Sister Chromatid Cohesion,0.6402,0.8777425373134329,-0.7423730068969036
2757,R-HSA-1614603,1.0141219260464236,Transcriptomics,Cysteine formation from homocysteine,0.4567,0.8777425373134329,-0.7436782404420609
2758,R-HSA-69236,1.0137028772248415,Transcriptomics,G1 Phase,0.844,0.9132457496136012,-0.7447658390611425
2759,R-HSA-69231,1.0137028772248415,Transcriptomics,Cyclin D associated events in G1,0.844,0.9132457496136012,-0.7447658390611425
2760,R-HSA-6804760,1.013627240815409,Transcriptomics,Regulation of TP53 Activity through Methylation,0.7148,0.8854020979020979,-0.7449621456731992
2761,R-HSA-3642278,1.1739370504848035,Proteomics,Loss of Function of TGFBR2 in Cancer,0.6014,0.8777425373134329,-0.7454210010729331
2762,R-HSA-3656535,1.1739370504848035,Proteomics,TGFBR1 LBD Mutants in Cancer,0.6014,0.8777425373134329,-0.7454210010729331
2763,R-HSA-3645790,1.1739370504848035,Proteomics,TGFBR2 Kinase Domain Mutants in Cancer,0.6014,0.8777425373134329,-0.7454210010729331
2764,R-HSA-3642279,1.1739370504848035,Proteomics,TGFBR2 MSI Frameshift Mutants in Cancer,0.6014,0.8777425373134329,-0.7454210010729331
2765,R-HSA-162588,1.0132730889683048,Transcriptomics,Budding and maturation of HIV virion,0.7534,0.8946156451066711,-0.7458813107919592
2766,R-HSA-1251985,1.013176162179338,Transcriptomics,Nuclear signaling by ERBB4,0.6072,0.8777425373134329,-0.746132874419878
2767,R-HSA-2426168,1.0130406760086026,Transcriptomics,Activation of gene expression by SREBF (SREBP),0.8253,0.9086347908147216,-0.7464845150035222
2768,R-HSA-9663891,1.0124389373033464,Transcriptomics,Selective autophagy,0.8221,0.9077917981072556,-0.7480462666448077
2769,R-HSA-2453902,1.1724448185687206,Proteomics,The canonical retinoid cycle in rods (twilight vision),0.3982,0.8777425373134329,-0.7486765877977444
2770,R-HSA-5674135,1.0117449396550076,Transcriptomics,MAP2K and MAPK activation,0.6219,0.8777425373134329,-0.749847466994518
2771,R-HSA-8940973,1.0112399096573486,Transcriptomics,RUNX2 regulates osteoblast differentiation,0.5692,0.8777425373134329,-0.751158221015911
2772,R-HSA-5362517,2.0521667210890855,Metabolomics,Signaling by Retinoic Acid,0.7119,0.8854020979020979,-0.7532757644649195
2773,R-HSA-425366,2.0497192374089286,Metabolomics,"Transport of bile salts and organic acids, metal ions and amine compounds",0.8011,0.902319257837492,-0.7544581667028261
2774,R-HSA-109606,1.009861176463921,Transcriptomics,Intrinsic Pathway for Apoptosis,0.6686,0.8777425373134329,-0.7547365828678612
2775,R-HSA-9634285,1.0098384863334984,Transcriptomics,Constitutive Signaling by Overexpressed ERBB2,0.6287,0.8777425373134329,-0.7547954727948658
2776,R-HSA-156711,1.1695727107249032,Proteomics,Polo-like kinase mediated events,0.3946,0.8777425373134329,-0.7549426353656744
2777,R-HSA-2980767,1.1695727107249032,Proteomics,"Activation of NIMA Kinases NEK9, NEK6, NEK7",0.3946,0.8777425373134329,-0.7549426353656744
2778,R-HSA-176412,1.1695727107249019,Proteomics,Phosphorylation of the APC/C,0.3946,0.8777425373134329,-0.7549426353656773
2779,R-HSA-176417,1.1695727107249019,Proteomics,Phosphorylation of Emi1,0.3946,0.8777425373134329,-0.7549426353656773
2780,R-HSA-216083,1.1695224509940274,Proteomics,Integrin cell surface interactions,0.53,0.8777425373134329,-0.7550522864935375
2781,R-HSA-1852241,2.043782286361933,Metabolomics,Organelle biogenesis and maintenance,0.8078,0.9031140210795272,-0.757326363235135
2782,R-HSA-1592230,2.043782286361933,Metabolomics,Mitochondrial biogenesis,0.8078,0.9031140210795272,-0.757326363235135
2783,R-HSA-6804756,1.167775909938738,Proteomics,Regulation of TP53 Activity through Phosphorylation,0.6086,0.8777425373134329,-0.7588626968008471
2784,R-HSA-186712,1.0077441967274554,Transcriptomics,Regulation of beta-cell development,0.8185,0.9059734513274336,-0.7602309885777047
2785,R-HSA-6802948,1.0073530293496638,Transcriptomics,Signaling by high-kinase activity BRAF mutants,0.6355,0.8777425373134329,-0.761246223743645
2786,R-HSA-9637690,1.0072260226578487,Transcriptomics,Response of Mtb to phagocytosis,0.7498,0.8946156451066711,-0.7615758567017111
2787,R-HSA-442660,1.0069812390052468,Transcriptomics,Na+/Cl- dependent neurotransmitter transporters,0.509,0.8777425373134329,-0.762211167789184
2788,R-HSA-9701898,1.0066998208190048,Transcriptomics,STAT3 nuclear events downstream of ALK signaling,0.7962,0.902319257837492,-0.7629415600847304
2789,R-HSA-5653890,1.0066067870864484,Transcriptomics,Lactose synthesis,0.8165,0.905784469096672,-0.7631830196804748
2790,R-HSA-2160916,1.0065641811137416,Transcriptomics,Hyaluronan uptake and degradation,0.5842,0.8777425373134329,-0.7632935991516342
2791,R-HSA-6803207,1.0062346692432478,Transcriptomics,TP53 Regulates Transcription of Caspase Activators and Caspases,0.6794,0.8786055923473142,-0.7641488137158156
2792,R-HSA-8957322,1.0056186019941533,Transcriptomics,Metabolism of steroids,0.7928,0.902319257837492,-0.765747753636102
2793,R-HSA-76005,1.005218859193674,Transcriptomics,Response to elevated platelet cytosolic Ca2+,0.7226,0.8854020979020979,-0.7667852454399158
2794,R-HSA-1226099,1.0049976370970135,Transcriptomics,Signaling by FGFR in disease,0.7831,0.9003598298985933,-0.7673594049040323
2795,R-HSA-373760,1.0041565553436145,Transcriptomics,L1CAM interactions,0.8527,0.9174193548387096,-0.7695423470969682
2796,R-HSA-390466,1.004122013579375,Transcriptomics,Chaperonin-mediated protein folding,0.7685,0.9001672240802675,-0.7696319967347974
2797,R-HSA-8876198,1.0041176298675116,Transcriptomics,RAB GEFs exchange GTP for GDP on RABs,0.709,0.8854020979020979,-0.7696433742133236
2798,R-HSA-933543,1.0035780520203812,Transcriptomics,NF-kB activation through FADD/RIP-1 pathway mediated by caspase-8 and -10,0.5984,0.8777425373134329,-0.7710437936661466
2799,R-HSA-9007101,1.0030843787964017,Transcriptomics,Rab regulation of trafficking,0.6993,0.8854020979020979,-0.7723250723358984
2800,R-HSA-1655829,1.0030700062804256,Transcriptomics,Regulation of cholesterol biosynthesis by SREBP (SREBF),0.8143,0.9044257614213198,-0.7723623747401128
2801,R-HSA-983189,1.0029839952040462,Transcriptomics,Kinesins,0.8675,0.9239406779661016,-0.7725856077456199
2802,R-HSA-205025,1.1612726926503791,Proteomics,NADE modulates death signalling,0.6374,0.8777425373134329,-0.7730506977706433
2803,R-HSA-1169408,1.0020161036652606,Transcriptomics,ISG15 antiviral mechanism,0.5738,0.8777425373134329,-0.7750976718460028
2804,R-HSA-416572,1.0018914195412851,Transcriptomics,Sema4D induced cell migration and growth-cone collapse,0.7454,0.8923563611491109,-0.7754212768153359
2805,R-HSA-74217,0.9992852492018883,Transcriptomics,Purine salvage,0.6402,0.8777425373134329,-0.7821853270076699
2806,R-HSA-1483255,0.9986751953569721,Transcriptomics,PI Metabolism,0.7287,0.888658536585366,-0.7837686597486888
2807,R-HSA-114608,0.9984690712813894,Transcriptomics,Platelet degranulation ,0.7338,0.8897836538461539,-0.7843036338338488
2808,R-HSA-189483,1.1559947090061315,Proteomics,Heme degradation,0.6199,0.8777425373134329,-0.7845656193460304
2809,R-HSA-189445,1.1559947090061315,Proteomics,Metabolism of porphyrins,0.6199,0.8777425373134329,-0.7845656193460304
2810,R-HSA-373076,1.1559385556266788,Proteomics,Class A/1 (Rhodopsin-like receptors),0.5909,0.8777425373134329,-0.7846881285851972
2811,R-HSA-375276,1.1559385556266788,Proteomics,Peptide ligand-binding receptors,0.5909,0.8777425373134329,-0.7846881285851972
2812,R-HSA-442742,0.9973055763965154,Transcriptomics,CREB1 phosphorylation through NMDA receptor-mediated activation of RAS signaling,0.7008,0.8854020979020979,-0.7873233665354469
2813,R-HSA-191273,0.9970661638221483,Transcriptomics,Cholesterol biosynthesis,0.7674,0.9001005361930295,-0.7879447375353447
2814,R-HSA-1227986,0.9969136629081867,Transcriptomics,Signaling by ERBB2,0.6961,0.8849128540305011,-0.7883405381554421
2815,R-HSA-400685,0.9967250285275567,Transcriptomics,Sema4D in semaphorin signaling,0.6951,0.8845385174418605,-0.7888301195152225
2816,R-HSA-354192,0.9962437471202832,Transcriptomics,Integrin signaling,0.6541,0.8777425373134329,-0.7900792364843723
2817,R-HSA-1358803,0.99569273575231,Transcriptomics,Downregulation of ERBB2:ERBB3 signaling,0.8182,0.9059734513274336,-0.7915093304782975
2818,R-HSA-8934903,0.9955172147723743,Transcriptomics,Receptor Mediated Mitophagy,0.6659,0.8777425373134329,-0.7919648773395849
2819,R-HSA-844456,1.1523896662418074,Proteomics,The NLRP3 inflammasome,0.4427,0.8777425373134329,-0.7924307033449839
2820,R-HSA-8956321,1.9695115239217504,Metabolomics,Nucleotide salvage,0.8362,0.9123129675810474,-0.7932072626389934
2821,R-HSA-888590,0.9944992008598758,Transcriptomics,"GABA synthesis, release, reuptake and degradation",0.7399,0.8897836538461539,-0.7946070289658781
2822,R-HSA-1483248,0.9944782866810438,Transcriptomics,Synthesis of PIPs at the ER membrane,0.8392,0.9132457496136012,-0.7946613095910593
2823,R-HSA-8875360,0.9944424353618383,Transcriptomics,InlB-mediated entry of Listeria monocytogenes into host cell,0.7615,0.8969559367642113,-0.7947543580456831
2824,R-HSA-3371453,0.9943507274664467,Transcriptomics,Regulation of HSF1-mediated heat shock response,0.6837,0.8788546255506609,-0.7949923765658407
2825,R-HSA-8964043,0.9941253787698197,Transcriptomics,Plasma lipoprotein clearance,0.8601,0.9205288902476306,-0.7955772462006917
2826,R-HSA-8854214,0.9940442151703897,Transcriptomics,TBC/RABGAPs,0.7137,0.8854020979020979,-0.7957878980725344
2827,R-HSA-9612973,0.9940249735436657,Transcriptomics,Autophagy,0.8765,0.9276534623525854,-0.7958378377587382
2828,R-HSA-9018677,1.1505008066171678,Proteomics,Biosynthesis of DHA-derived SPMs,0.5007,0.8777425373134329,-0.796551608582791
2829,R-HSA-9018678,1.1505008066171678,Proteomics,Biosynthesis of specialized proresolving mediators (SPMs),0.5007,0.8777425373134329,-0.796551608582791
2830,R-HSA-9033241,0.9936725349557534,Transcriptomics,Peroxisomal protein import,0.7466,0.8927570891697985,-0.7967525562874227
2831,R-HSA-1250196,0.9933540808292549,Transcriptomics,SHC1 events in ERBB2 signaling,0.6804,0.8786055923473142,-0.7975790716011109
2832,R-HSA-5357769,1.1496533670608045,Proteomics,Caspase activation via extrinsic apoptotic signalling pathway,0.5499,0.8777425373134329,-0.7984004585772467
2833,R-HSA-111471,0.9927448311242929,Transcriptomics,Apoptotic factor-mediated response,0.6569,0.8777425373134329,-0.7991603172786216
2834,R-HSA-1643713,0.9927252376532073,Transcriptomics,Signaling by EGFR in Cancer,0.7165,0.8854020979020979,-0.7992111701411001
2835,R-HSA-948021,1.147346412518785,Proteomics,Transport to the Golgi and subsequent modification,0.7196,0.8854020979020979,-0.8034335171124486
2836,R-HSA-5658623,1.147134023037249,Proteomics,FGFRL1 modulation of FGFR1 signaling,0.488,0.8777425373134329,-0.8038968850173472
2837,R-HSA-9687136,0.9907040824991439,Transcriptomics,Aberrant regulation of mitotic exit in cancer due to RB1 defects,0.8008,0.902319257837492,-0.8044568728881215
2838,R-HSA-211728,0.9892552404621251,Transcriptomics,Regulation of PAK-2p34 activity by PS-GAP/RHG10,0.832,0.911421875,-0.8082171951168775
2839,R-HSA-9634597,0.9884429135119641,Transcriptomics,GPER1 signaling,0.811,0.9035918626827718,-0.8103255071410048
2840,R-HSA-9013409,0.9879777334550373,Transcriptomics,RHOJ GTPase cycle,0.8381,0.9132457496136012,-0.8115328346920714
2841,R-HSA-6811440,0.9879621032403432,Transcriptomics,Retrograde transport at the Trans-Golgi-Network,0.7211,0.8854020979020979,-0.8115734013254604
2842,R-HSA-2122947,0.9872079096790272,Transcriptomics,NOTCH1 Intracellular Domain Regulates Transcription,0.8701,0.9239406779661016,-0.8135308340482413
2843,R-HSA-9696270,1.141976219084213,Proteomics,RND2 GTPase cycle,0.5845,0.8777425373134329,-0.8151496118205388
2844,R-HSA-156584,1.917967586249569,Metabolomics,Cytosolic sulfonation of small molecules,0.8991,0.93868374032162,-0.8181086206125812
2845,R-HSA-8985947,0.985418631208095,Transcriptomics,Interleukin-9 signaling,0.7206,0.8854020979020979,-0.8181747244350258
2846,R-HSA-210744,0.9853463528889971,Transcriptomics,Regulation of gene expression in late stage (branching morphogenesis) pancreatic bud precursor cells,0.8502,0.9158818097876268,-0.8183623154649772
2847,R-HSA-1679131,1.1403088455916932,Proteomics,Trafficking and processing of endosomal TLR,0.5141,0.8777425373134329,-0.81878730308625
2848,R-HSA-6804116,0.9850139000546384,Transcriptomics,TP53 Regulates Transcription of Genes Involved in G1 Cell Cycle Arrest,0.5994,0.8777425373134329,-0.8192251630019137
2849,R-HSA-199977,0.9849685521644699,Transcriptomics,ER to Golgi Anterograde Transport,0.7999,0.902319257837492,-0.8193428588411225
2850,R-HSA-9033500,0.9847734537222513,Transcriptomics,TYSND1 cleaves peroxisomal proteins,0.6184,0.8777425373134329,-0.8198492170156683
2851,R-HSA-9703465,0.9844442311594451,Transcriptomics,Signaling by FLT3 fusion proteins,0.7029,0.8854020979020979,-0.8207036807111555
2852,R-HSA-2173791,0.9834865658644499,Transcriptomics,TGF-beta receptor signaling in EMT (epithelial to mesenchymal transition),0.7596,0.8969559367642113,-0.8231892036353029
2853,R-HSA-8876384,0.9827750591510603,Transcriptomics,Listeria monocytogenes entry into host cells,0.8056,0.902319257837492,-0.8250358469835131
2854,R-HSA-5696395,0.9824607380268752,Transcriptomics,Formation of Incision Complex in GG-NER,0.7788,0.9003598298985933,-0.8258516355098269
2855,R-HSA-418889,1.1368826201823723,Proteomics,Caspase activation via Dependence Receptors in the absence of ligand,0.7197,0.8854020979020979,-0.8262622631367473
2856,R-HSA-3270619,0.9819883215218297,Transcriptomics,IRF3-mediated induction of type I IFN,0.8155,0.9049619530754598,-0.8270777445263826
2857,R-HSA-9613829,0.9814479770294051,Transcriptomics,Chaperone Mediated Autophagy,0.7877,0.9008983992159426,-0.8284801537291353
2858,R-HSA-9603798,0.9804855464671374,Transcriptomics,Class I peroxisomal membrane protein import,0.632,0.8777425373134329,-0.8309780444200875
2859,R-HSA-73621,1.8856447630197124,Metabolomics,Pyrimidine catabolism,0.8058,0.902319257837492,-0.8337240785755079
2860,R-HSA-9623433,0.97882412678593,Transcriptomics,NR1H2 & NR1H3 regulate gene expression to control bile acid homeostasis,0.562,0.8777425373134329,-0.8352900903152991
2861,R-HSA-9660821,0.9779947803876716,Transcriptomics,ADORA2B mediated anti-inflammatory cytokines production,0.8428,0.9132457496136012,-0.8374425745868949
2862,R-HSA-196849,1.877917920196318,Metabolomics,Metabolism of water-soluble vitamins and cofactors,0.8493,0.9151939655172414,-0.8374569885517442
2863,R-HSA-9022699,1.131720175147058,Proteomics,MECP2 regulates neuronal receptors and channels,0.4649,0.8777425373134329,-0.8375251153404822
2864,R-HSA-8964038,1.1312927268720285,Proteomics,LDL clearance,0.4266,0.8777425373134329,-0.8384576747601886
2865,R-HSA-8964011,0.9773303697783604,Transcriptomics,HDL clearance,0.7689,0.9001672240802675,-0.8391669847844034
2866,R-HSA-190370,1.13091807418444,Proteomics,FGFR1b ligand binding and activation,0.4792,0.8777425373134329,-0.8392750506003528
2867,R-HSA-9694631,0.9769870316137147,Transcriptomics,Maturation of nucleoprotein,0.7544,0.8946156451066711,-0.8400580840895797
2868,R-HSA-445095,0.976956748163548,Transcriptomics,Interaction between L1 and Ankyrins,0.7705,0.9003598298985933,-0.8401366817061007
2869,R-HSA-8853884,0.9762970240865587,Transcriptomics,Transcriptional Regulation by VENTX,0.8148,0.9044719314938152,-0.8418489284853652
2870,R-HSA-204005,0.9758830501772743,Transcriptomics,COPII-mediated vesicle transport,0.7545,0.8946156451066711,-0.8429233556854555
2871,R-HSA-1614635,1.8652621937023166,Metabolomics,Sulfur amino acid metabolism,0.8665,0.9239406779661016,-0.8435710882902482
2872,R-HSA-400685,1.128709209101388,Proteomics,Sema4D in semaphorin signaling,0.6482,0.8777425373134329,-0.8440941083914236
2873,R-HSA-9614085,0.9732913606565585,Transcriptomics,FOXO-mediated transcription,0.7774,0.9003598298985933,-0.8496498223849134
2874,R-HSA-170834,0.9731533248728323,Transcriptomics,Signaling by TGF-beta Receptor Complex,0.8293,0.9110536218250236,-0.8500080802299006
2875,R-HSA-114452,0.9722946170188093,Transcriptomics,Activation of BH3-only proteins,0.7183,0.8854020979020979,-0.8522367691752701
2876,R-HSA-9682385,0.9713144301145515,Transcriptomics,FLT3 signaling in disease,0.7857,0.9003598298985933,-0.8547807446468819
2877,R-HSA-2408522,1.8419585349525427,Metabolomics,Selenoamino acid metabolism,0.8459,0.9134751773049644,-0.8548293036076945
2878,R-HSA-6807878,0.9711535456799537,Transcriptomics,COPI-mediated anterograde transport,0.8574,0.9202391904323828,-0.8551983038425854
2879,R-HSA-156580,1.8380702236478828,Metabolomics,Phase II - Conjugation of compounds,0.794,0.902319257837492,-0.856707783135702
2880,R-HSA-9637687,0.9705206087442503,Transcriptomics,Suppression of phagosomal maturation,0.739,0.8897836538461539,-0.8568410273196208
2881,R-HSA-5620971,1.1216079816456612,Proteomics,Pyroptosis,0.6082,0.8777425373134329,-0.8595867818730475
2882,R-HSA-5693548,0.9684976565070795,Transcriptomics,Sensing of DNA Double Strand Breaks,0.5874,0.8777425373134329,-0.8620913942131693
2883,R-HSA-110313,0.9684471087351364,Transcriptomics,Translesion synthesis by Y family DNA polymerases bypasses lesions on DNA template,0.738,0.8897836538461539,-0.8622225858169433
2884,R-HSA-9029569,0.9680020723353473,Transcriptomics,NR1H3 & NR1H2 regulate gene expression linked to cholesterol transport and efflux,0.7943,0.902319257837492,-0.8633776325535607
2885,R-HSA-3000178,0.967465224648166,Transcriptomics,ECM proteoglycans,0.681,0.8786055923473142,-0.8647709661537633
2886,R-HSA-190377,1.1188525690293776,Proteomics,FGFR2b ligand binding and activation,0.5444,0.8777425373134329,-0.8655982366866521
2887,R-HSA-1368082,0.966870815804924,Transcriptomics,RORA activates gene expression,0.7743,0.9003598298985933,-0.8663136938832894
2888,R-HSA-9651496,0.9660868633185394,Transcriptomics,Defects of contact activation system (CAS) and kallikrein/kinin system (KKS),0.7548,0.8946156451066711,-0.8683483628710185
2889,R-HSA-9671793,0.9660868633185394,Transcriptomics,Diseases of hemostasis,0.7548,0.8946156451066711,-0.8683483628710185
2890,R-HSA-416550,1.1173169114898147,Proteomics,Sema4D mediated inhibition of cell attachment and migration,0.5251,0.8777425373134329,-0.8689485646388789
2891,R-HSA-5668914,1.8082211887708106,Metabolomics,Diseases of metabolism,0.8333,0.911421875,-0.8711281308275555
2892,R-HSA-382551,1.8071598000209488,Metabolomics,Transport of small molecules,0.8045,0.902319257837492,-0.8716408976514164
2893,R-HSA-194306,0.964170700915806,Transcriptomics,Neurophilin interactions with VEGF and VEGFR,0.4608,0.8777425373134329,-0.8733215676047319
2894,R-HSA-3214841,1.1151814436996519,Proteomics,PKMTs methylate histone lysines,0.4605,0.8777425373134329,-0.8736074923256462
2895,R-HSA-111461,0.963884452330574,Transcriptomics,Cytochrome c-mediated apoptotic response,0.7122,0.8854020979020979,-0.874064496709835
2896,R-HSA-3769402,0.9635962891499996,Transcriptomics,Deactivation of the beta-catenin transactivating complex,0.8535,0.9174600737100738,-0.8748123949525257
2897,R-HSA-2980767,0.9628503408940351,Transcriptomics,"Activation of NIMA Kinases NEK9, NEK6, NEK7",0.6337,0.8777425373134329,-0.8767484278234223
2898,R-HSA-354194,0.9628261992532228,Transcriptomics,GRB2:SOS provides linkage to MAPK signaling for Integrins ,0.7058,0.8854020979020979,-0.876811084998094
2899,R-HSA-1247673,0.9622527079445278,Transcriptomics,Erythrocytes take up oxygen and release carbon dioxide,0.7607,0.8969559367642113,-0.8782995233930219
2900,R-HSA-114508,1.1114168858703557,Proteomics,Effects of PIP2 hydrolysis,0.8475,0.9138170055452866,-0.881820588669285
2901,R-HSA-168927,0.9607172140189288,Transcriptomics,"TICAM1, RIP1-mediated IKK complex recruitment",0.8594,0.9205288902476306,-0.8822847417902119
2902,R-HSA-1660499,0.9601072512068528,Transcriptomics,Synthesis of PIPs at the plasma membrane,0.7678,0.9001672240802675,-0.8838678382647479
2903,R-HSA-200425,0.9591320757299934,Transcriptomics,Carnitine metabolism,0.5517,0.8777425373134329,-0.8863988070859713
2904,R-HSA-9706377,0.9588841211134147,Transcriptomics,FLT3 signaling by CBL mutants,0.7896,0.9014183240952072,-0.8870423480881098
2905,R-HSA-76005,1.10876596336522,Proteomics,Response to elevated platelet cytosolic Ca2+,0.7491,0.8945240532241556,-0.8876040785030087
2906,R-HSA-2132295,0.9586625546789477,Transcriptomics,MHC class II antigen presentation,0.8986,0.93868374032162,-0.8876174012460005
2907,R-HSA-5626467,0.958005954951594,Transcriptomics,RHO GTPases activate IQGAPs,0.8787,0.9285778985507248,-0.8893215390933834
2908,R-HSA-264870,0.9574476968414448,Transcriptomics,Caspase-mediated cleavage of cytoskeletal proteins,0.775,0.9003598298985933,-0.8907704412699774
2909,R-HSA-8876493,0.9560521894973611,Transcriptomics,InlA-mediated entry of Listeria monocytogenes into host cells,0.783,0.9003598298985933,-0.8943923387248219
2910,R-HSA-6809371,0.9548987444566902,Transcriptomics,Formation of the cornified envelope,0.8438,0.9132457496136012,-0.8973859880773821
2911,R-HSA-6805567,0.9548987444566902,Transcriptomics,Keratinization,0.8438,0.9132457496136012,-0.8973859880773821
2912,R-HSA-6807004,0.9536007658712565,Transcriptomics,Negative regulation of MET activity,0.8358,0.9123129675810474,-0.9007547595531867
2913,R-HSA-1855204,0.9531796976237259,Transcriptomics,Synthesis of IP3 and IP4 in the cytosol,0.8376,0.9132457496136012,-0.9018475993870384
2914,R-HSA-1236394,0.9531176639833168,Transcriptomics,Signaling by ERBB4,0.8092,0.9035918626827718,-0.9020086013948494
2915,R-HSA-177128,1.7404104560889424,Metabolomics,Conjugation of salicylate with glycine,0.9667,0.974776721405935,-0.9038881294854346
2916,R-HSA-1483257,1.7356157929366296,Metabolomics,Phospholipid metabolism,0.8564,0.9194478527607364,-0.9062044760610077
2917,R-HSA-5689877,0.9509959424605601,Transcriptomics,Josephin domain DUBs,0.7648,0.897887323943662,-0.9075153139289975
2918,R-HSA-8856688,0.9509431452645204,Transcriptomics,Golgi-to-ER retrograde transport,0.8628,0.922824427480916,-0.9076523436843548
2919,R-HSA-189200,0.9506244313406828,Transcriptomics,Cellular hexose transport,0.7741,0.9003598298985933,-0.9084795332756278
2920,R-HSA-425407,1.7293546197258898,Metabolomics,SLC-mediated transmembrane transport,0.812,0.9035918626827718,-0.9092293073505159
2921,R-HSA-381771,0.9500585318668026,Transcriptomics,"Synthesis, secretion, and inactivation of Glucagon-like Peptide-1 (GLP-1)",0.7248,0.8857541899441341,-0.9099482678350224
